Pilot,Description,Skill1,,Skill2,,Skill3,,Skill4,,image
Kobayashi Maki,"A tactical student of ACE college who is good at data analysis and currently works as an intern in OATH company. Because she often provides free analysis services, she is very popular with various teams in the company.",Data Share,All reader.pilot attributes increase by 50. Can not be stacked；Shares one of her skills (except the co-reader.pilot) with all alliess. Success rate: 40%,Air Ability,Ignore aircraft's evasion. Secondary armament and missle ATK+14%,Full Evasion,Evades attacks once every 3.4s. The effect cannot be stacked with other 100% Evade effects.,Direct Hit,"Ranged attack have a 14% chance to ignore all shield, defense status, interception, blocks, barriers and defensive abilities. This effect cannot stack.",https://i.imgur.com/EzqDrtS.png
Kuon,A servant who is in charge of Oboro's daily life and mecha maintenance. Her family has been serving the Oboro Swordmaster since the Era of the Great Heaven Emperor. She is gentle but she will go blank sometimes. The mysterious rabbit that follows her around is named Lele.,Supply,Heals 16% HP and reloads ammo for a random ally.,Defense Talent,HP +14%,Damage Resistance,"Activates when receiving melee attack, DEF+50%. Minimum interval: 6s",Repair,Heals 5% HP for a random ally every 4s,
Layla,Captain of Rhein Federation's special force Azure Girls. She's a born optimist who enjoys pleasing everyone with funny jokes. Her past is a mystery and she seems to be an old friend of the Dark Knight.,Dual-gun rapid fire,The first two weapons rapidly fires for 2.1s,Critical Explosion,14% chance for single-shot weapons to quintuply spray without guidance. Mininum interval: 1.5s,Weakness Focus,Final damage+21% to the target that debuffed. (Exception: knock down and slow down),Elemental Affinity,Non-normal attacks damage+10%. Non normal attacks taken-10%,https://i.imgur.com/pJzgsEa.png
Lexxie,"The world's most famous e-sports commentator, now working as a Far East television station's announcer for the Mecha World Cup. Secretly an expert marksman. Her voice possesses a mysterious power, and it is said that can not only change the tide of battle, but has even caused games to lag at opportune moments.",Oriental Power,Heals 60% for 4s to the lowest HP unit but the unit will lose control,Toughness,Activates when HP is lower than 20%. Heals 25% for 5s.,Jinx it!,Unpredictable effects will happen. The ratio of buff and debuff ranges from 5:5 to 8:2.,The Chosen one,Activates on debut. The appointed opponent's defense and focus fire for 2s.,
Li Lin,"She is strong, tenaciousr and has a gift in leadership . She has a burning heart hiding under the ice-cold look.",Steel Flood,Launches artillery rockets towards where the reader.pilot is facing for 3.5s. Damage increases with skill level. Rockets can also activate Li Lin’s passive skills.,Converge,Commands allies to attack the same target Li Lin is attacking every 7s. Buff the entire team’s attack by ATK+7% briefly.,Endurance,Reduce final damage received by -28%. Value decreases by 1% each second.,Crossfire,Missile weapons that are not drones have 30% chance to call upon artillery support. Damage increases with skill level.,https://i.imgur.com/Db22ovE.png
Lilulu,The Vatican janitor. She works in Tech Eye which is under the management of Cynthia. She stopped growing up since she ate too much sugar.,Dangerous Game,Launches multiple blades to deal fire damage. Increases 1 blade for every 2 skill levels,Elemental Affinity,Non-normal attacks damage+10%. Non normal attacks taken-10%,Heat Saw,Launches a high-heat saw when injured. Interval: 3s.,Corrosion,Attacks (except normal attribute) halve target's DEF every 4.4s,
Linda,One of the six royal candidates for the Valhalla Union. The only survivor of the Tyrfing Kingdom's royal family. A girl who was said to be cursed by the Demon Sword.,Demon Sword Master,Doubles the range of melee weapons and ATK+ 0% throughout the battle. Cannot be stacked.,Defense Crush,5% chance to apply Armor Penetration and knockdown effect for melee attacks. Interval: 1.5s,Cold Blood,"ATK+ 1% every 1s, up to 100%.",Damage Resistance,"Activates when receiving melee attack, DEF+50%. Minimum interval: 6s",https://i.imgur.com/y5BI9t2.png
Liselotte,"A leader of the evil group Noisy Bat, who has been working hard for the goal of dominating the world. Her weapon is a modified Gatling gun with extremely poor accuracy.",Secondary Armament Rapid Fire,All secondary armaments fire at the same time for 2.1s. Increases the reload speed and doubles the scatter degree.,Dual-Gun Volley,Uses two identical secondary armaments to attack simultaneously. Affected weapon's attack + 9.6%.,Dadada,Increases large magazine weapon's attack. Each max capacity increases weapon attack by 1%.,Aggressive,ATK+ 20%. HP-5%.,https://i.imgur.com/gsx2VT2.png
Lulu,A member of the Rosy Tri-Stars team which is from G.O.E Mercenary Company. She has a keen sixth sense that saves the team from danger every time. She is fascinated with the love divination of tarot card.,Divination,"Applies random debuffs to all enemies, ignoring debuff resistance. Effect increases with skill level",Swoop In,Group Aura: The duration for the abnormality effect on enemy's status +14%.,Good Luck,"Activation rate of skills, chassis features and parts+4%.",Intuition,Activates when an enemy casts the active skill. Enters stealth for 1s and increases reload speed.,
Machiavelli,"The ancient prime minister who attached his soul to the dead housemaid, he was insidious and crafty. After knowing this era, ""he"" began to looking for his former master..",Doppelganger,Copies enemy's units for 4.8s. Boss is also affected. Clones an enemy unit for 4.8s. Boss is also affected,Curse of the Poor,The magazine of enemy who attacks Machiavelli will be cleared. Minimum interval: 7s  Destroys the magazine of the enemy who attacks Machiavelli. Minimum interval: 7s.,Scapegoat,"When receiving fatal damage, switches position with a random ally. Heals 10% HP and enters stealth. Upon taking fatal damage, switches position with a random ally. Heals 10% HP and enters stealth.",Intuition,Activates when an enemy casts the active skill. Enters stealth for 1s and increases reload speed. Activates when an enemy casts an active skill. Enters stealth for 1s and increases reload speed.,https://i.imgur.com/oCk0KvD.png
Mafia Kajita,"A tough guy who always shows up in all kinds of games’ events. With a perfect cosplay of a character who happens to look like him, Kajita now is the star in community. Actually he is the leader of a war hawk group in real life. Being a mercenary, he has reaped a considerable amount of money and lives. The hero of U.S.F, Wood is his acquaintance. Covered by mist, this past is known by few people.",Tit for Tat,Deals damage equal to 35% of current lost health to its current target. Ignores Tenacity effects.,A Murderous Glare,Female pilots that target Mafia Kajita will lose ATK -28% and have a chance to receives a random status condition.,SSR Weapon Master,"ATK +14%, magazine +14% for Rank 5 weapons.",Tips for ULT,Last Mech’s ability cooldown -21%.,https://i.imgur.com/BkvbOAj.png
Marilu,"A member of the Midnight Theater. She is a young girl with multiple personalities. Hiding under her shyness are some outstanding assassination skills. As one of the executioners in the organization, her codename is Death Clown.",Sniping,Fires powerful sniper shells for 3s.,Sniper,"When no enemies are nearby, final damage dealt+14%.",One Shot One Kill,15% chance for single shot weapon to fire a shell that ignores target's DEF,Night falls,Becomes Enters stealth on debut for 2.5s,https://i.imgur.com/H3y5RI2.png
Masato Akitsu,"A gentle, good-natured 15-year-old boy with a secret - his body also hosts another personality, the mad scientist Masaki Kihara. As he pilots the Zeorymer more and more frequently, Masato's personality is gradually being replaced by Dr. Kihara's as the king of hell descends to earth.",冥王,立即使用最强的机甲动作指令3秒内最终伤害增加15%,双重人格,每秒增加3%怒气，怒气全满时发动，木原正树人格觉醒，机师全参数提高120，驾驶志雷马时效果翻倍,我会赢的,耐久低于50%时触发，负面效果持续时间降低50%，Heals 35% HP，驾驶志雷马时额外回复15%耐久,Force,Damage taken decreases with lower HP. Up to 20%. Cannot be stacked.,
Matilda,"A Vatican Grand Knight. When she was young and was dying from the war, the Pope saved her accidentally and then reformed her. Since then, she has never left the Pope ever.",Death flash,Teleports continuously to evade attacks in 3s. Improves her tenacity,Robust,Activates after receiving 10 attacks. Increases stats and becomes immune to debuffs within 1s.,Force,Damage taken decreases with lower HP. Up to 20%. Cannot be stacked.,Vanish,Enters stealth for 1.5s when HP is lower than 35%. Heals 15% HP,https://i.imgur.com/jZrjLkC.png
Mephis,A Legendary bounty hunter with Level SS license. She captured countless evil people in her career and each story is epic and magnificent.,Lightning Speed,Random weapons fire for 2.1s. Firing speed+ 400%. Can be stacked with akimbo effect,Ace hunter,Faster weapon switch action. Attack interval-25%,Direct Hit,"Ranged attack have a 14% chance to ignore all shield, defense status, interception, blocks, barriers and defensive abilities. This effect cannot stack.",Reload Master,The reload speed of all weapons+14%.,https://i.imgur.com/BmIMsA5.png
Meruru,"A girl surrounded by mysteries. Besides food and cats, she also loves making fun of others and she always talks in a mocking way.",Brilliance,Applies random buffs for 3.5s,Robust,Activates after receiving 10 attacks. Increases stats and becomes immune to debuffs within 1s.,Taunt,Increases chance to become the enemy's target. HP +0%.,Emergency Refuge,Teleports when injured. ATK and DEF increase for a while. Interval: 5s,https://i.imgur.com/PUKuW98.png
Mia,"Member of Rosy Tri-Stars team from G.O.E Mercenary Company. As the main attacker, she is good at assaulting. Having zero interest in men, she fell in love with Oglala from the company.",High-Pitch Shock,Destroys all enemy shells and shields. Effect increases with skill level.,Assault,"Activates on debut, ATK+25% for 15s.",Healthy Condition,Final damage+12% when HP is higher than 50%,Full Absorption,Absorbs 10.5% of damage dealt into HP. Can be stacked.,https://i.imgur.com/p35jqAo.png
Midori,An employee of OATH Company. A glasses-wearing girl with a friendly personality. She treats everyone with care and warmth like a young sister next door. Her smile will melt your heart.,Supernova,Launches a supernova that can blocks missiles. Knocks up and down nearby enemies for 1s Launches a supernova that can block missiles. Knocks up and down nearby enemies for 1s,Ballistics,Bullet speed+20. Non-missile weapon scattering angle-50%,Corrosion,Attacks (except normal attribute) halve target's DEF every 4.4s,Anti-stealth,Removes the enemies' stealth and targets them. Chance increases with skill level,https://i.imgur.com/fnCmlbn.png
Miku Himuro,"A young girl who pilots the Zeorymer together with Masato Akitsu and Masaki Kihara, Miku Himuro is good-natured and extremely skilled in battle. Her true identity is that of an artificial life-form created by Dr. Kihara: the Zeorymer's ""Dimensional Linkage System"".",次元屏障,回复15%耐久，展开无法被破坏的次元屏障抵御远程攻击，持续6秒,次元连结,冷却时间大于10秒的机甲指令，冷却加快10%，冥王攻击（次元连接攻击，烈·冥王攻击）冷却额外加快20%，不可叠加,动力源,移动速度提升50%，大幅提高转向和刹车灵敏度,紧急召回,耐久低于20%时进行一次空间跳跃回避攻击，同时Heals 35% HP,
Mira,红色短发赏金猎人，西莱茵人，协会内的多面手，帅气，任性，有主见，善于突袭的她往往在电光火石之间便解决了她的对手。,Rapid Fire,快速移动并使用前俩门武器连续射击，ATK & DEF +50% and becomes immune to debuffs for 3s,Akimbo,"When using 2 identical weapons simultaneously, ATK+0%.",Continuous Evasion,Gains extra melee evasion and high-speed evasion commands to mecha. Upgrade to increase CD.,快速反击,使用非攻击类机甲指令后，自身ATK+50% briefly，Reloads 20% bullets,
Mizuhara Risa,"Vice president of the student council at A.C.E. Academy. She has excellent academic performance and excels in data collection. She and Takahashi Natsumi are good friends. Having taken an interest in classical music, she wishes to be a musician just like Sawano Hiroko.",Rebound Shield,"Gains a shield that can bounce off shells for 5s, but cannot block melee attacks.",Rhythm Bubble,Launches a bubble that can bounce off shells or stun enemies every 3s.,Calm Down,Activates when HP is less than 50%. This reader.pilot’s shooting and reaction stats increase by 100,Ice Mastery,"Normal attacks (except fire attribute) apply freezing effect, Freeze attribute ATK and DEF+ 14%",https://i.imgur.com/z92uMTV.png
Mutsuki,Born with uncontrollable spiritual power and was treated and imprisoned as an alien for a long time by her own tribe. She has a strong heart underneath the weak appearance and loves her older sister very much.,Telekinesis Burst,Casts all enhanced passive skills.,Telekinesis throw,Bounces off nearby enemies when collides. Minimum interval: 7s. Affected by tenacity,Mental destroy,Triggers when takes fatal damage. Invincible but can not move in 2.1s. Mentality getting out of control will bombard enemies,Dense Ward,Creates a ward that can block bullets for 1.05s when takes damage. Interval: 4.9s,https://i.imgur.com/7nwcBsH.png
Nadia,"Nicknamed the Bride of Anubis, and the ace of the Anti-Vaca Union. An enthusiast of archaeology, she initially did not wish to be involved in the war, but the imploration of her tribe left her no choice.",Main Armament Rapid Fire,Reloads and fires all main armaments. Increases the first main armament's reloading and firing speed greatly for 1.5s.,Critical Dartle,14% chance for the main armament to fire freely. Minimum interval: 1s,Sniper,"When no enemies are nearby, final damage dealt+14%.",Calm Down,Activates when HP is less than 50%. This reader.pilot’s shooting and reaction stats increase by 100,https://i.imgur.com/Fw1DxRT.png
Nagase Aya,An infamous female gangster of a local gang in Far East. Some say there are thousands of people who work for her. She is quite bold and forthright and likes to drive recklessly with people she's fond of late at night. Her nickname is Midnight Queen.,Race Mode,Significantly boosted for 2.5s for all allies. Capable of evading bullets. Significantly boosts the team's Evasion for 2.5s. Can also evade bullets.,Drift Moment,Mech and tank's defense action cooldown time-21%. Evasion rate+21%,Acceleration Aura,Group Aura: Speed +5%. Becomes immune to slow effect except freezing,Dash,Collides with an enemy and deal damage. Stuns for 0.5s. Damage increases with speed and weight Collides with an enemy and deals damage. Stuns for 0.5s. Damage increases with speed and weight,https://i.imgur.com/7KUN10F.png
Nakira Karuma,"A ""ghost"" of the inner hall of the Divine Empress's palace and a wild and unrestrained young warrior. He has an outspoken and straightforward manner, disregards trifling matters, and has no interest in anything but combat. Surprisingly, he is extremely gentle towards small children, but always assumes a stoic manner out of the worry that he'll frighten them.",秘剑·彼岸花,全方位斩击！持续3s秒,Enrage,"Activates when takes damage. Increases all weapon attack by 1% permanently, at most 50 times",Enthusiasm,ATK+15%. Becomes immune to freezing effect. The duration of stun and interference-50%,Survival Instinct,Heals up to 2% HP per second. Recovery speed increases with lower HP. This effect cannot be stacked with recovery per second buffs.,
Nana,"Although it's hard to imagine from her appearance, Nana is a veteran explorer. Her relationship with the Mechanical Vatican runs quite deep, and she once served as a caving guide in the Vatican's forbidden areas. Nana has a sunny and optimistic disposition - no matter how dire the circumstances, she always survives with a smile.",Blasting site,Plants landmines in the fan-shaped range to the front. Numbers increase with skill level,Iron bone,"Upon taking 14 times of fatal damage, remains active, charges and removes all debuffs",Modified Man,"Becomes immune to freezing, burning and paralysis. Normal and explosive damage taken -0%",Huge Discharge,Releases electromagnetic stars when grabs an enemy. Damage increases with skill level,https://i.imgur.com/hOfkflO.png
Nanase Yuzuki,"Former scientist from Takahashi Jyuukou. She was sabotaged by her colleagues and her project Organic Mechanical eventually failed. Facing the questions from her supervisor and sarcasm from her colleagues, she chose to resign in anger.",Gravity Wave,The enemy will be unable to move nor perform melee attacks for 3s,Vitality,Activates after using a mecha action. Heals 1.5% HP.,Resistance Aura,Group Aura: Debuff resistance+ 20%. Applies only to living allies.,Anti-gravity,"Activates once every 3s. Normal, explosive, freeze and EM attacks apply knock up effect",
Nymeria,"A cold-hearted girl always emerging from the shadows. Rescued by Kaoru when grievously wounded, she promised to serve as Kaoru's guard for three years. No matter what Kaoru tries, nothing can unlock her frozen heart.",高周波匕首雨,高速投掷匕首攻击，ATK+50% for 3s,防身匕首,受近身攻击时，绕到敌方身后并投掷周波匕首进行反击，最小间隔3.2s秒，不能与必闪类技能叠加,警觉,每秒一次，3个身位内有隐身敌人时，概率解除目标隐身并短暂提升攻击力，升级提升概率,大难不死,倒地时防御大幅提升，回复少量耐久，升级提升防御和耐久回复量,
Oboro,Descendant of the Oboro Swordmaster from The Era of the Great Heaven Emperor. The strongest swordswoman in the Far East region. She has a strong sense of responsibility towards her younger sister and she travels around the world looking for a way to cure her sister.,Moon Wheel,Quickly approaches the enemy to attack. Damage increases with skill level,Foresight Cut,21% chance to block all frontal attacks. Can be stacked,Full Evasion,Evades attacks once every 3.4s. The effect cannot be stacked with other 100% Evade effects.,Unlimited Awakening,The reader.pilot's active skills can be used indefinitely. Gains SP after 3s,https://i.imgur.com/wHpqA2t.png
Oglala,"An orphan adopted by G.O.E. She was abandoned in the wild just after her birth and was found and raised by a she-wolf. After being adopted, she later becomes a great spy.",Hide,Enters stealth for 2.5s and heals HP,Magazine Destruction,Firearm attacks apply magazine destruction effect. Enemy's magazine-50% every 6s.,Lone Wolf,"When all allies have been killed, heals all HP, ATK & DEF +50% and becomes immune to debuffs for 4s .",Survival Instinct,Heals up to 2% HP per second. Recovery speed increases with lower HP. This effect cannot be stacked with recovery per second buffs.,https://i.imgur.com/wVRHISj.png
Orlando,A war orphan who was adopted by Ossin. He is very grateful for what Osin did and is willing to do anything for him. He has feelings for Amanda but is always gets teased by her.,FS Field,Blocks ranged attacks for 4.5s. Invaild for melee attacks and grenades,Perfectionism,"When 4 or more allies are alive, final damage+ 16%.",Shield Sync,The regen shield's regenerative interval-20%. Other shields' duration+ 20%. Can be stacked.,Frugality,7.5% chance to attack without consuming ammo. The effect cannot be stacked with other ammo-saving effects.,https://i.imgur.com/umrje6N.png
Oscar,"A mysterious man who is active behind the battlefields all over the world. He is an excellent tactician who has attracted leaders from different countries. However, Oscar seems to be planning something and has not joined any forces so far.",Conspiracy Illusion,"Creates clone units for your team, up to 5 and lasts 1s Creates clone units of your team, up to 5, for 1s",Quick Reaction,"Moving speed, mecha's action CD speed, weapon switch speed or action cohesion speed-7%.",Fair Trade,"When colliding, swaps your debuff for enemy's buff. The minimum interval: 3s",Escape,Increases evasion possibility when moves. Mecha gains an extra escape command. CD decreases with skill level. Min: 10s,
Osin,A controversial leader of the 7th generation of the Solomon family. He is cruel and cold but has an irresistible charm to females.,Limiter Removal,All allies' ATK and DEF increase. Recovers 20% HP. Becomes paralyzed upon skill duration expiry. Effect improves with skill level.,Thrilling Murder Intent,Gives the target a fearful stare once every 3. Freezes and stuns target.,Greedy heart,Buff received by the reader.pilot+ 10%. Increases shield duration. Applies only to Solomon’s Key faction pilots.,Mental tolerance,Becomes immune to paralysis and interference. The duration of stun-50%,https://i.imgur.com/FhWcHEM.png
Paula,"The ""Azure Girl""'s personal hacker. A lazy, arrogant digital warrior, she refers to herself as the Genius Beauty of Hacking - and truly is extremely talented. Rather than a hacker, however, her true wish is to become an e-sports competitor.",Full invasion,All enemies ATK and speed-50% for 2s,Operational suppression,Adds 15% of the reader.pilot's reaction to the other three attributes,Crash,"Activates after 30 shots, the target disconnects for 2.5s. All your actions go into cooling",Logical trap,"1 enemy only, explodes it when its SP is full. Halves the SP. Damage increases as level ups Afflicts one enemy, when its SP bar is full makes it explode. Halves the SP. Damage dealt increases with skill level",https://i.imgur.com/24CWuQD.png
,,,,,,,,,,
Ren,"A ""miracle"" AI accidentally brought to life in the form of an elementary school girl, she longs to join the world of grown-ups. As a result of psychological pollutants linked to the AI, she speaks and imagines in what she imagines to be a ""grown-up"" manner.",瞬间失忆,使敌人大脑空白的精神干预，清空全体敌人动作冷却，负作用是自身无法行动1s,Fallen Curse,Causes various debuffs to enemies. Average interval: 7.5s,Missile Interference,Activates once every 5s and interferse 8 enemy missiles at most,Maintenance Interference,Interferes enemies maintenace. All enemies HP recover effect-15%,
Rena Sayama,公开宣称喜欢奥特曼的超人气偶像。虽然在演出时给人以乖巧的印象，但骨子里自由奔放。与奥特曼有很复杂的因缘，但喜欢奥特曼的心情是货真价实的。,Live Show,3.5s秒内，自己和敌方全体跟随音乐起舞,Inviolability,Taking damage might prompt public outrage. ATK+21% for 3s for all allies. The effect doubles for male allies.,保持初心,耐久低于1/3时立刻Heals 35% HP，对早田进次郎效果翻倍,你可是奥特曼啊！！,限1次，我方处于劣势时，一名友军8s秒内获得金身效果，同时立刻回复1/3耐久，有奥特曼在场时优先使奥特曼获得强化,
Richter,"Former prime mecha designer of Empire. After witnessing the Grand God soldiers, he indulged in their beautiful design. He later joined Osin in order to further his research on them.",EM Attraction,Gradually attracts enemies and paralyzes them for 2s,Faith,The duration of debuffs -40%.,Weapon Expert,Range and speed of non-instantaneous main and secondary shells+25%. Accuracy of missile guidance+ 25%.,Repair,Heals 5% HP for a random ally every 4s,
Rolland,"One of the few true heroes of the Rhein Federation, a swordsman trained by the Black Knight. With the hopes of the nation and the people on his shoulders, his burden is a heavy one. He loves his homeland and comrades deeply, and shows no mercy to the enemy.",Excalibur,ATK & DEF +10% and becomes immune to debuffs for 3s,Sword shield switching,35% chance to Gains a shield for 2s when action is over,Transition,Final damage taken-21%. . The value is converted to ATK at 1% per second,Sword skill,8% chance for melee attacks to ignore immunity to stun them,
Rosa,"A trainer at A.C.E. Academy, formerly a captain of the Far East. She used to be the leader of the Far East's guerrillas and wiped out the drug dealers in the Golden Triangle Area. Thus she earned the name ""Tiger of Southeast Asia"".",Assault Command,ATK+20% for 4s and reload speed +30%,Command Aura,Group Aura: ATK and DEF+ 4%. Cannot be stacked with identical aura. Applies only to living allies.,Frugality,7.5% chance to attack without consuming ammo. The effect cannot be stacked with other ammo-saving effects.,Ballistics,Bullet speed+20. Non-missile weapon scattering angle-50%,https://i.imgur.com/GEr9ID1.png
Saiki Kaede,"A second-year student at the A.C.E. Institute with very few friends, her lonely appearance actually conceals a fierce and radiant heart. After revealing her surprising abilities at her school's talent scouting competition, she was selected by Takahashi Jyuukou as a test reader.pilot for their new mech.",Martial Art,Immediately uses the strongest mecha action and other mecha actions CD-20%.,Good Luck,"Activation rate of skills, chassis features and parts+4%.",Focus,9% chance to block all attacks. Can be stacked.,Obsession,The duration of most of debuffs-100%. Buffs effect-50%,https://i.imgur.com/Oogu6s1.png
