Pilot,Description,Skill1,,Skill2,,Skill3,,Skill4,,image
Adad,星团评议会直属的特工，同时也是移民管理局的代理人，身手高强，说话语气彬彬有礼，似乎有着自己的打算。,爆弹投下,在全部敌人的头顶设置爆弹阵，数量随技能等级提高,防身匕首,受近身攻击时，绕到敌方身后并投掷周波匕首进行反击，最小间隔3.2s秒，不能与必闪类技能叠加,Intuition,敌人发动主动技能时触发，Enters stealth for 2.5s并加快动作冷却,强化剂,耐久低于1/3时，立刻巨大化撞击敌人，同时20秒内全属性增加60%,https://i.imgur.com/ptN30hE.png
Airu,Tysha's younger sister who was quite young at the time of the village tragedy and her character was not affected by the hatred. She is a naive and lively girl and has a special interest in explosives.,Burst Fire,"The first main armament 5× scatters, dealing 50% bonus damage",Machinist,Heals 0.75% HP per second. Cannot be stacked with other recover per second type effects.,Emergency Shield,"When HP is lower than 25%, gains an emergency shield that lasts for 2s.",Self-Destruction,Deals 15% of Max HP damage when being destroyed. Cannot be stacked,https://i.imgur.com/B0a0M4k.png
Alice,"A member of Rosy Tri-Stars team, which belongs to the world's biggest mercenary company G.O.E. She's the close-combat expert and the mechanic in the group. Besides her lazy and frivolous personality, she also prefer boys who are younger than her.",Trust,Recovers 25% of HP for the ally with the lowest HP. Grants a shield for 2s,Toughness,Activates when HP is lower than 20%. Heals 25% for 5s.,Machinist,Heals 0.75% HP per second. Cannot be stacked with other recover per second type effects.,Force,Damage taken decreases with lower HP. Up to 20%. Cannot be stacked.,
Alniyat,Senior combat spy with a code name of Alniyata. A hardworking person who works hard to make sure everything is in the right order. She likes Lesbian fiction and always imagines her two elder sisters doing such things.,Assassination,Becomes stealth and assassinates the target. Damage increases with skill level,Consecutive Assassination,Launches a melee attack with a 19% chance to deal extra damage.,Empty Cicada,Teleports to the back of the enemy after receiving a melee attack. CD: 5.6s. The effect cannot stack with other 100% Evade skills.,Assassin,"Every 15s, becomes stealth and increases attack briefly. Max: 5 times.",
Alniyata,"A Takahashi combat corps special agent, the oldest of the three Alniyat sisters. A cold and quiet beauty of few words, she is a master of killing and interrogation techniques. Despite this, she is a surprisingly grounded and reasonable person with a deeply considered and enlightened understanding of what it means to kill.",冰岚刃舞,使用特殊剑技“冰岚刃舞”升级提高伤害,协同作战,友方隐身时，自己2秒内受到最终伤害降低，升级提升效果，最高35%,二刀流,驾驶持有两把剑形格斗武器的机体时，使用机甲动作触发，减少自身动作冷却时间，升级提高效果,冷艳,每3秒，以自己为目标的敌人受到短暂冰冻效果,
Amanda,Pilot of Agares. She has been with millions of men in her life and is believed to be the incarnation of libido. She thought no man can resist her until she met Osin.,Ice Melody,Summons a blizzard to freeze enemies and blocks shells for 3.6s,Scapegoat,"When receiving fatal damage, switches position with a random ally. Heals 10% HP and enters stealth.",Libido,"For every male reader.pilot on the battlefield, final attack and defense+5%. Can be stacked.",Crisis Phantom,"When HP is lower than 40%, creates a clone that lasts for 3s at most.",https://i.imgur.com/AQXkSXW.png
Amy,"Being preciseness and serious, she is a low-key maths genius. She graduated from Empire Academy maths department with the 1st ranking at the age of only 16.",Disturbing Wave,Releases Disturbing Waves to interfere nearby enemies for 1s,Precision Guidance,"Missile attack+ 10%, Missile's guidance capability+25%.",Ballistics,Bullet speed+20. Non-missile weapon scattering angle-50%,Pellet Bash,16.5% chance to knock down an enemy and deal bonus damage when main armaments attack with normal and explosive attributes,
Andrea,"One of the Vatican Knights. Nicknamed ""one-man army"". She is able to control multiple mechas on her own. Just like Wynonna, she is also a freak in the Vatican. Unlike other members, she is actually more interested in human body.",Mecha Spirit Sea,Releases many Mecha Spirits. Spirit numbers increase as level ups.,Fire Spirit,Releases a Mecha Spirit that can deal fire damage every 10s.,Paralysis Spirit,Releases a Mecha Spirit that can paralyze enemies every 10s.,Interception Spirit,Releases a Mecha Spirit that can intercept missiles and drone every 10s.,
Annabelle,出身于贵族世家谢菲尔德家族，同时也是艾莉西亚的妹妹，作为女王的贴身女仆在帝国皇宫里任职。行事恪尽职守，无论战斗还是家务都可以快速，优雅地完成，非常能干。不过在完美的表象下，有放飞自我，狂热喜爱枪械的一面。,大扫除,限30次，射击对敌方造成强力冲击效果，击退敌人，升级提升击退距离,女仆的职责,除自己外友军耐久低于50%时，Heals 28% HP，每名友军仅生效1次,忠义之心,全体光环：提升我方的回复能力，所有我方受到耐久恢复效果提升28%，对秒回光环无效。,一尘不染,每射击命中10次，驱散目标增益效果并造成小幅击退,
Antares,"A Takahashi combat corps special agent, and the second of the three Alniyat sisters. An extremely clever young woman, she seems to be having second thoughts about her mission, but keeps them hidden deep down. Extremely adept at concealing her emotions, even her sisters who share a mystical bond with her often struggle to determine her true feelings.",Flame barrier,Creates a layer of flame protection for all allies to burn nearby enemies and destroy missiles. Upgrade to increase damage.,Overheat,Causes overheat while dealing fire damage. Interval: 5s,Special Fuel,Fire distribute increases 6%. Enemy burning resistance decreases 25% permanently,Assassin,"Every 15s, becomes stealth and increases attack briefly. Max: 5 times.",
Arashi,"A ninja newly sworn to the service of the Divine Empress's palace, frequently deployed from the palace to carry out certain small missions. He has an indifferent personality and cares little about wealth or status, but has a strong affinity for snacks of all kinds. Under the orders of the Divine Empress, he occasionally engages in small talk with the Divine Empress about foreign customs and foods outside the palace walls, and has no idea how great a comfort this is to the Divine Empress.",Multilple Replication,"Creates 4 temporary duplicates, gets in stealth Enters stealth for 1.3s and recover little HP",替身术,Teleports when takes melee attack and leaves a duplicate. CD 10s. Can not be stacked with 100% evade skill,Shadow Crevice,"When target gets knocked down around, gets Paralysis for 2s to ignore immunity. Minimum interval 8s",碎片收集,召唤或幻象单位阵亡时，回复自身5%耐久，最多触发20次。,
Archduchess Ann,"Archduchess of Mjollnir Kingdom. Despite her young age, she has long been a famous brave warrior. After all, who would know that this girl, who looks extremely cute and a little bit short, would be a formidable opponent with the title of ""God Hammer""?",Epic Strike,"A jump attack that deals great damage, depending on weight, fighting, and skill level.",Perfect armor,Withstands 3200 shell damage. Not bonused by defense. Cannot be stacked with other shield like effect,Armor Explosion,Activates when take damage the first time; Explodes and temporarily enhances yourself. Damage increases as skill level ups,Challenger,"Activates when the enemy casts an active skill, ATK & DEF +50% and becomes immune to debuffs for 2.5s .",
Archduchess Arseille,"The Archduchess of the ""Divine Lance"" Gungnir Kingdom. As a righteous, brave, and a broad-minded lady, the straightforward combat style is perfect for her. She hates anything that beats around the bush.",Unbreakable,Collides to all enemies and activates all skills parts and chassis features that can be activated by action.,Cleanse,6% chance for melee attacks to destroy shields and force fields and apply knockdown effect.,Purify,16% chance for melee attacks to remove selves debuffs and enemies' buffs,Vitality,Activates after using a mecha action. Heals 1.5% HP.,
Archduchess Rhea,"One of the six royal candidates for Valhalla Union, Archduchess of Sillven Kingdom. As a princess of a relatively weak country, she prevented the invasion of the neighboring Tyrfing Kingdom several times with her wisdom and diplomatic strategy.",Sillven's Shield,A shield that can withstand any attacks. No time limit but it can withstand up to 25 rounds,Love,Recovers 0.6% of HP per second for all allies. Cannot be stacked with same kind of recovery effects.,Pacifism,"HP+ 20%, ATK -5%",Polar Leader,"Group Aura: Freezing, fire defense and abnormal resistance +9%. The effect doubles for the six Valhalla kingdoms. Group Aura: Ice, fire defense and freezing, burn resistance +9%. The effect doubles for the six Valhalla kingdoms",https://i.imgur.com/7XqnVdY.png
Archduchess Trista,"One of the six royal candidates in Valhalla Union, Archduchess of Guran Kingdom. She is an exceptional sharpshooter and is considered a hot prospect for the next ""Battle of Electors"".",Missile rapid shot,Missle weapons and drones fire in a volley for 1.6s. Reloads randomly,Dual-Shell Volley,Using 2 same missile weapons to attack simultaneously. Affected weapon's attack +9.6%.,Awaken,The reader.pilot's active skill can be used twice. Gains 0% SP when in the battle,Multiple Load,15% chance for normal and explosive missles to inflict random abnormalities.,https://i.imgur.com/gdEMpgL.png
Auru & Fillo,"The twin maids of the Takahashi Family and they are always around Natsumi, however, no one knows who is the older one, including Natsumi herself.",Elemental Blast,ATK & DEF +20% and becomes immune to debuffs for 4.2s . Launches many elemental bombs for 4.2s,Elemental Affinity,Non-normal attacks damage+10%. Non normal attacks taken-10%,Akimbo,"When using 2 identical weapons simultaneously, ATK+0%.",Barrage Counter,"Cleanse freeze, burn, and paralysis status conditions every 1.5s and counter with an attack of the same element.",
Aya,"A slave girl from Qujra who became emotionally numb and could only blindly comply with the master's orders because of the tragic experience of her childhood , but surprisingly, she has a gift in operating machines.",Recovery Field,Allies heal12% of HP per second in 3s. Ying Qi will get recovered wherever he is.,Study,"Pilot's four attributes +5%, co-reader.pilot's ult will be the first choice",Adversity Survival,Debuff resistance+ 1% every 1s. Up to 100%.,Landmine Combinesor,Plants 1 random landmine every 5s.,https://i.imgur.com/PO2JbKF.png
Ayisha,An assassin from Qujra who was once a dancer. She is mediocre in dancing but quite talented in assassination. It seems that she does not care about anything and is listless all day long.,Rotating Shuriken,Lunches rotating shurikens at all enemies. Damage increases with skill level,Escape,Increases evasion possibility when moves. Mecha gains an extra escape command. CD decreases with skill level. Min: 10s,Master of Clone,The duration of mirror unit increases. The duration increases with skill level. Max 2s. Can be stacked.,Residual Image,HP+6%. Generates a mirror unit in the opposite direction every 4s to obstruct enemy's aim. Creates an afterimage in the opposite direction every 4 seconds. Enemy's target changes to the afterimage.,https://i.imgur.com/jNyZTMn.png
Bab,"A witch doctor of a God named Emma in a local tribe in South Africa. After the tribe joined Vaca, the latter started to push out local religions. He joined the Resistance Army for his own belief.",Landmine Array,Plants a landmine array. Damage increases with skill level,Anma's grace,Absorbs all freezing and fire damage taken into HP. Minimum interval: 2.5s,Iron Wall,The damage taken from turret or upper body's front-21%. Can be stacked,Sapper,Plants a landmine every 5s.,
Barmov,"His reputation goes somewhere between ""Graceful Beast"" and ""Cruel Gentleman"". But if we've seen his fight skills, perhaps people would much rather call him ""elegant torturer"".",Primal Roar,Roar continuously. Stun enemies forcibly. Increases allies' ATK for 3s,Survival Instinct,Heals up to 2% HP per second. Recovery speed increases with lower HP. This effect cannot be stacked with recovery per second buffs.,Rapid Combo,40% chance to cancel the post motion. ATK+ 50% and attack directly,Ultra,Mech’s ability cooldown -12%.,https://i.imgur.com/U5mS149.png
Becas,"Becas Shannam, a C-class mercenary of OATH Company. With an easygoing personality, he likes to do things in his own way, which also makes him sometimes unpredictable.",Fire At Will,Reloads and fires with all weapons for 1.5s. Gradually reduces melee skill's CD,Consecutive Battle,Activates when an enemy has been killed. Heals 15% HP. The effect halves if the enemy is killed by an ally.,Unyielding,"Upon taking fatal damage, remains active for 2.5s. Becomes immune to all debuffs and ATK+50%",Awaken,The reader.pilot's active skill can be used twice. Gains 0% SP when in the battle The reader.pilot's active skill can be used twice. Gains 0% SP when joins the battle,
Bemular,某日突然出现在进次郎与早田面前并对二人进行攻击的外星人，一直将自身包裹在神秘的装甲之中，似乎与早田父子有着千丝万缕的关系,神秘来客,化身红色光球在6s秒内抵御大部分伤害并吸引所有敌方注意，结束后消失,最初的敌人,开场6s秒内，以自己为目标的敌方无法发动攻击,拯救,队友濒死时发动，限一次，扣除自身当前40%的耐久，使濒死队友机体复原，恢复50%耐久。使用百慕拉外甲时，扣除耐久量减半,反击,耐久1/3以下时立刻使用最强动作指令，同时6秒内攻击提高35%,
Bethany,"Daughter of the province governor, who is dedicated to improving the citizens' living condition and advocates peaceful coexistence with the Freedom States. She has a strong personality and never compromise in the face of threats.",Mass Shield,Creates a shield for allies for 1.5s. The shield cannot block melee attacks and grenades.,Unity,"If there are 4 or more ally pilots on the battlefield, final damage taken-15%. Cannot be stacked",Guardian Aura,Group Aura: DEF+ 7.5%. Applies only to living allies.,Pacifism,"HP+ 20%, ATK -5%",https://i.imgur.com/Cnp4fZU.png
Bradley,A man who has been through countless battles. Nobody knows the limits to his strength nor where his hair is.,Iron Curtain,DEF+50% for 3.6s,Stillness,"20% chance to ignore all knockdown effects except throwning skills. Cancels weapon recoil, and becomes immune to stun, interference and knock up",Guardian Aura,Group Aura: DEF+ 7.5%. Applies only to living allies.,Man of Iron,Invalidates first 20 instances of damage,https://i.imgur.com/azNuGPZ.png
Byron,A War Institute weapon master banished by the Mechanical Vatican with a highly mechanized body. His superior power separates him from the others and he is now a member of the Phantom Cross.,Fuuma Shuriken,Throws 4 special shurikens. Damage increases with skill level,Full Absorption,Absorbs 10.5% of damage dealt into HP. Can be stacked.,Empty Cicada,Teleports to the back of the enemy after receiving a melee attack. CD: 5.6s. The effect cannot stack with other 100% Evade skills.,Telekinesis Resistance,Becomes immune to interference debuffs. The duration of Paralysis and stun-50%,https://i.imgur.com/TBjfu2m.png
Carlson,"Carlson Shelley, B-class mercenary from OATH Company. He is proficient in shooting guns and only takes 0.23 seconds to draw his pistol. With a fun and humorous personality, he calls himself a gentleman.",Secondary Armament Rapid Fire,All secondary armaments fire at the same time for 2.1s. Increases the reload speed and doubles the scatter degree.,Gentleman,"Every time there is a female reader.pilot in battle, your final damage taken-5%.",Secondary Armament Mastery,Secondary armament's attack+ 21%.,Consecutive Battle,Activates when an enemy has been killed. Heals 15% HP. The effect halves if the enemy is killed by an ally.,https://i.imgur.com/8h2K0Bx.png
Carol,A trainee knight of the Lake Goddess. A simple girl who is upright and simple and travels around the world to make herself a better knight.,Battlefield Phantom,Creates a clone unit for 4.5s at most.,Concentration,The first weapon's attack +40%.,Force,Damage taken decreases with lower HP. Up to 20%. Cannot be stacked.,Unyielding,"Upon taking fatal damage, remains active for 2.5s. Becomes immune to all debuffs and ATK+50%",https://i.imgur.com/ErvCrLX.png
Catalina,"A Desert Pirate who struck fear in the whole Barbara Union with just one sea sand warship. She is bold and forthright and will not let go of anything she likes, no matter they are talented person or treasures.",Fixed Point Strike,Requests a bombardment support from the mothership. Adds 1 grenade for every 2 levels,Pirates' Force,"Summons a minion with the same star rarity as the leader every 12s, up to 5 times.",Triumph Aura,Group Aura: ATK+ 6%. Cannot be stacked with identical aura. Applies only to living allies.,Field Guard,Activates on debut. Whole team DEF+25% for 5s,https://i.imgur.com/J4dtdvI.png
Charlotte,"As a little bounty hunter, Charlotte is working hard in order to be as famous as her idol Mephis. The weapons she made by herself has become quite famous in the bounty hunter community already.",Hunter's Net,Releases a giant iron net to trap a target and reduces its ATK and DEF for 2.5s,Raid Tips,"If an enemy does not target at this mecha, increases the final damage dealt by 14%.",Critical Dartle,14% chance for the main armament to fire freely. Minimum interval: 1s,Ballistics,Bullet speed+20. Non-missile weapon scattering angle-50%,https://i.imgur.com/4ahvaXs.png
Cherise,"A rebellious girl who ran away from her home. In a gang fight, she was saved by Orlando and later joined Osin. She is tyrannical and vicious and fond of throwing knives.",Weakness Mark,Decreases resistance and take 1.5 times damage in 3s for all enemies,Fighting Spirit,"Gains 25% SP at the start of battle. Can be stacked. One-time use only. When SP is full, uses the ULT instantly.",Aggressive,ATK+ 20%. HP-5%.,Soul,ATK+75% for 5s when using your active skill,
Chosokabe Wayne,"A member of the mercenaries actually in control of the Dark Zone of the Dukedom, he is in outstanding physical condition and often achieves surprise victories even when using outdated and shabby equipment. An aesthete and dandy with an undisciplined nature, he pilots a bat mecha. After running into Eleven by chance in a battle, he is currently in mad pursuit.",Sniper kill,Shoots an arrow that ignores any DEF skills. Damage increases with skill level.,Joint destruction,Melee attack hit increases 1s for enemy's action CD. Minimum interval: 4s.,X cut,Melee attacks knock down and deal 30% of the target's current HP. Interval: 15s.,See through,I can see through your attack! DEF increases every1s. Max damage reduction: 33%.,https://i.imgur.com/q2GpSqg.png
Christine,A black sheep of the Mechanical Vatican. She had her sense of pain removed in order to become stronger and her body became extremely twisted after undergoing cybernetic modifications. She was always in detention for vandalism and eventually banished by the Vatican. She now serves the Phantom Cross after being recruited by Byron.,Death Spiral,Launches a drill to attack enemies continuously. Damage increases with skill level,Demolition,"Activates when an enemy has been killed. ATK+30% for 6s, the effect halves if the enemy is killed by a teammate.",Enthusiasm,ATK+15%. Becomes immune to freezing effect. The duration of stun and interference-50%,Indifferent,Nullifies one enemy's attack every 1.2s. Cannot be stacked with the same effect.,https://i.imgur.com/e1qKUNA.png
Clara,"A rebellious girl who mingled with the street gangs. She is capricious, competitive and moody, who likes jazz, hip-hop and rock'n'roll a lot.",Duel,Provokes an enemy and targets each other. Your ATK and DEF+60% within 4s,1v1,"When targeted by the enemy, ATK, DFE +9%.",Moody,Activates at the start of a battle. Gains random buffs. Damage increases with skill level.,Vitality,Activates after using a mecha action. Heals 1.5% HP.,https://i.imgur.com/D0n6BOw.png
Constance,"When you devote yourself to the god, you can hide yourself in steel. This is Constance. Despite being the most unnoticeable member of the War Institute that is loyal to the Mechanical God, nobody can forget her swift movement in the battlefield.",Full Absorption,Absorbs 50% damage dealt to HP for 8s.,Fear of Seckill,Increases 500% damage dealt to target with 99% or above HP,Crush,The final damage for knocked down enemies+ 30%.,Cleanse,6% chance for melee attacks to destroy shields and force fields and apply knockdown effect.,https://i.imgur.com/jX3Brmw.png
Cruz,Nobody understands what you are talking about hahahaha...so just act cute~,Missile rapid shot,Missle weapons and drones fire in a volley for 1.6s. Reloads randomly,Extra Load,Reloads an extra ammo for the first missile weapon. CD Reduction of the weapon+10%.,Inviolability,Taking damage might prompt public outrage. ATK+21% for 3s for all allies. The effect doubles for male allies.,Human Purge!,This effect is activated randomly. ATK+75% briefly.,https://i.imgur.com/gVP7u8r.png
Cynthia,"She is the aunt of Slokai the Pope in family's hierarchy. As an extreme expansionist, she is in charge of the Tech Eye. She sleeps during the day while takes control of the Mechanical Vatican at night.",Skill Copy,Copies a random reader.pilot's ULT with the same skill level.,Nightbird,ATK and HP+ 10% from 18:00 to 06:00.,Anti-stealth,Removes the enemies' stealth and targets them. Chance increases with skill level,Unlimited Awakening,The reader.pilot's active skills can be used indefinitely. Gains SP after 3s,https://i.imgur.com/NfIV9nS.png
Dai,"Being sharp and insightful, Dai the anti-hero, serves as a spy in the Far East under the code name of Spirit Snake.",Multitask,"Activated skills, chassis features and parts can be activated ignoring trigger type and halves its interval for 6s",Cadence,Removes all debuffs. Reloads 6% bullets immediately upon missile attacks. Minimum interval: 4s,Chaotic dance,Short time defense action's cool down time-50% (Including Chariot Charge )when Secondary armament or drone attacks. Interval: 3s,Hidden Danger,Main armament's attacks apply armor penetration. Decreases resistance and take 1.5 times damage in 0.7s. Minimum interval: 4s,
Dan Moroboshi,SSSP（Sicence Special Search Party科学特别搜查队）所属的执行队队长，是一位不论何时都保持着认真态度的，沉着干练的青年男性，身着“奥特曼装甲7.0（通称SEVEN）”进行战斗，对待犯下了罪责的外星人完全不留任何情面。,到此为止了,使用剑形格斗武器的机体时，施展特殊剑技“拔刀·格杀”，升级提升伤害，使用赛文装甲时必定触发瞬时强化效果。,奥特意念,首次凝视目标时，使目标怒气降低，3秒内断开控制，且ATK-50% for 6s，对每个目标仅生效1次。,Advanced Sword Arts,Permanently increases 1% melee damage when there is a successful melee hit. At most 50 times,战斗意志,受伤触发，减少受到伤害0.5%，最多叠加到35%，使用赛文外甲时，耐久提升777,
Divine Empress,"Queen of Hinomaru. Despite having no actual power, she still has enormous influence over citizens and clerics. Born indifferent and desireless, she didn't even fight back when being imprisoned in the royal castle.",Evil Dispel,Removes debuffs and enemies' buffs for 1s,Amulet,One time only. 50% chance to activate. Enters stealth and heals 75% when takes fatal damage,God among Us,"Activates 10s after appearing, ATK & DEF +99% and becomes immune to debuffs for 3s and heals HP for nearby allies.",Resurrection,One time only. Releases when an ally is dead. Creates a phantom of a dead ally for 3s.,https://i.imgur.com/2eqrxTI.png
Doctor Aoi,The client who entrusted Becas to test the mecha. She was surprised to see Becas driving Vassago and decided to go with Becas to check on the performance of mecha.,Electronic Jam,Stuns the enemy and reduces the enemy's accuracy greatly for 4.2s,Iron Wall,The damage taken from turret or upper body's front-21%. Can be stacked,Pre-emptive Strike,Activates when battle begins. Takes actions quicker than the enemy. Damage increases with skill levels,Swoop In,Group Aura: The duration for the abnormality effect on enemy's status +14%.,https://i.imgur.com/ax8c27q.png
Doris,"As the assistant for Dr. Aoi, she is just causing trouble all the time instead of helping her.",Static Space,Immobilizes all units and shells except yourself for 3s.,Distraction,Interferes a random enemy for 2.5s on debut,Unawareness,Raids the enemy while the enemy is preparing for battle. Empties the enemy's magazine for 0.3s.,Crisis Phantom,"When HP is lower than 40%, creates a clone that lasts for 3s at most.",https://i.imgur.com/ob1s1Ne.png
