Pilot,Description,Skill1,,Skill2,,Skill3,,Skill4,,image
Doyle,"A gifted marksman from the Federated States special forces, he is a seasoned veteran who has returned alive from innumerable hellish battlefields. No one knows for sure when exactly he joined the military. He is a man of few words, but possesses an awe-inspiring affinity for machinery.",Sniper kill,Shoots an arrow that ignores any DEF skills. Damage increases with skill level.,Eagle Eye,"Shooting range of main and secondary armament increases 25%.. The further away from the target, the more damage deals, up to 14%. Cannot be stacked",Ambush,"Upon taking damage, receives Enters stealth for 2s together with allies in certain range. Increases ATK by 50%, interval 15s",Air raid command,Mecha gains a skill-Air Support. CD increases with level. 14s at most.,
Eddie,"Chairman of the Demolition Club in A.C.E. Academy. He always carries a large amount of dangerous explosives with him, and is nothing less than a walking powder keg.",Reversal,Launches a large shell to knock up the enemy. Damage increases with skill level,Social Outcast,Reduces the chance of becoming the enemy's target. Ef'fect increases with skill level,Demolition Expert,Group Aura: Increases the explosion range and the attack of explosive weapons by 14%.,Blast shell,30% chance for main armament and missile to deal a wider explosive range. Interval: 1s,https://i.imgur.com/aQ0FAVl.png
Edith,"A member of Cold Brook Knights from Empire, an outstanding knight who is well disciplined. But it also makes her often forgets that she is a girl and never had a boyfriend.",Absolute Field,"Grants a large-scale defensive field that can bounce off shells for 3s. DEF increased

Grants a large defensive field that can reflect ranged attacks for 3s. Increase user's defense by 50%",Adaptability,"Freezing, fire and EM defense+7%. Status abnormality resistance+70%.

Reduce Ice, fire and EM damage by -7%. Increase immunity to freeze, burn and paralysis by +70%.",Force,"Damage taken decreases with lower HP. Up to 20%. Cannot be stacked.

Decreases final damage recieved the lower the user's HP is. Maximum 20%. This effect cannot stack.",Tenacity,"Damage received from one attack is less than 5% of the maximum HP.

Received damage for each hit cannot exceed {value} of maximum HP.",
Elaine,"A mysterious girl who has lost her memories. She is cold and aloof and is naturally hostile to anyone who gets close to her because of her messed up memories. Meanwhile, She would also show her weak side at some time.",Fire At Will,Reloads and fires with all weapons for 1.5s. Gradually reduces melee skill's CD,Concentration,The first weapon's attack +40%.,Tenacity,Damage received from one attack is less than 5% of the maximum HP. Damage received from one attack cannot exceed 5% of the maximum HP.,Ace Pilot,Swap weapons faster. All attributes+10%,https://i.imgur.com/9mJDTmS.png
Elena,"A ""mechanical ghost""-type bounty hunter without an organic body, she spent her life as an ordinary human as a member of the Vatican Knights 300 years ago. She suffers from a severe lack of common-sense knowledge of contemporary society - after all, brain-death and a knight's disposition are a difficult mix. Charlotte and Aalter have taken pity on her, and she know accompanies them on their travels.",Tarantula hunting,Lauches hooks to pull and paralyze the enemies. Hook numbers increase as skill level increases.,Bloodthirsty,"When there is 1 enemy whoseHP is lower than 50%, final damage dealt+9.6%",Full Absorption,Absorbs 10.5% of damage dealt into HP. Can be stacked.,Soul,"Action cooldown time-5%. Minmum interval: 1s；Upon taking fatal damage, becomes stealth for 2s. Action CD-50%",https://i.imgur.com/K5x2nXx.png
Eleven,"She refers to herself as an arms dealer, but is actually a mercenary from the Far East monitoring Gwen Pullan and collecting data on his Armored Gull. Although she comes across as a sober and mature woman, a raging thirst for destruction lurks under the surface.",Air strike,Calls the mothership for air striking for 1.5s. Damage increases with skill level,Explosive Power,Charges to the front of the team and ATK & DEF +35% and becomes immune to debuffs for 3.5s .,Irritable,ATK+40% briefly when takes damage,Black cat,Final ATK and DEF+8.5% if there is no allies nearby,https://i.imgur.com/TEEEOS2.png
Ellie,"Adopted daughter of the president of OATH Company, Karin Heinrich. She is young but very thoughtful and she treats the employees like her own family. The doll she holds in arms is an A.I. which can help Ellie control mecha.",Missile pack,Launches different types of missiles. Increases 1 missile per 3 levels.,First Aid for All,8s after battle begins or debuts as reinforcements. Heals 10% HP for allies,Adaptability,"Freezing, fire and EM defense+7%. Status abnormality resistance+70%.",Playing Cute,"The attack of Ellie's target-20%, lasting 12s at most.",
Eloiti,"No one knows where Eloiti comes from, but at the same time, no one doubts that she ranks among the quickest draws in the wilderness. She is often compared to an eagle - free, brave, and full of strength.",不可防御,限一次，普通属性主炮、副炮攻击无视任何防御技能和异常抗性。持续7s,Akimbo,"When using 2 identical weapons simultaneously, ATK+0%.",Magazine Switch,Has 5 magazines. Swiftly reload half of the magazine if any weapon's mag is empty.,Concentration,ATK+22.5% if no damage taken in the past 1s,
Erica,"Instructor at A.C.E. Academy. She is very gentle and soft to the students, sometimes over protecting them.",Targeted Fire Focused Fire,The target will take 1.5x more damage when receiving targeted fire attacks for 3.6s. The target's debuff resistance will be weakened. Focused unit will take 1.5x more damage for 3.6s. Reduces the unit's debuff resistance.,Guardian Heart,"When destroyed, generates a large shield to protect allies. Heals 5% HP.",Love,Recovers 0.6% of HP per second for all allies. Cannot be stacked with same kind of recovery effects.,Field Guard,Activates on debut. Whole team DEF+25% for 5s,https://i.imgur.com/HvBvtSl.png
Field,"The first ranking master of one of the Grand God's ""Silver Lancer"". He is a aristocratic loafer who is free from trifles and lives at liberty. He was once the prince of the Empire but gave up his title to travel around the world for the absurd goal of ""meeting all the wonderful women in the world"".",Supply to All,Reloads ammo for all allies for 2s.,Choice,The reload speed of the first weapon+75%. the reload speed of other weapons-50%. Invalid to melee weapons.,Exile,"Everytime when there is a female reader.pilot on the enemy side, your final damage dealt+5%",Drone Recycle,Recycles drones will double its amount. Heals 1% HP. Cannot be stacked.,
Fillo,"The warrant officer of the Empire Harp Artillery regiment. Just like all the other regiment members, she is an energetic and optimistic lady from western empire and will cause a lot of troubles without supervision.",Supply to All,Reloads ammo for all allies for 2s.,Dual-Armament Volley,Uses 2 identical main armaments to attack simultaneously. Affected weapon's attack + 9.6%.,Ballistics,Bullet speed+20. Non-missile weapon scattering angle-50%,Quick hand,Weapon reload speed + 10%. Effect doubles on main armaments.,https://i.imgur.com/Kd2Nmpm.png
Fiona,"A female mercenary who is together with Gwen Pullan, she possesses an outstanding aptitude for learning. In her past life, she served as a resistance fighter assigned to protect Gwen Pullan. She typically performs her tasks calmly and earnestly, and excels at caring for others. Although she may seem serious and unreachable, she still has a hidden girlish side.",Trap analysis,Removes allies debuffs. Abnormal resistance +12%.. Cannot be stacked by re-activating.,Cover aura,Group aura: DEF+25% briefly and removes debuffs when HP is lower than 50%,Guerrilla command,Random ally becomes stealth. Average interval: 7.2,Awareness,Strengthens ATK if not being destroyed in 2.5s when takes fatal damage. Taunts all enemies.,https://i.imgur.com/e4rm7Ht.png
Fritz,"Captain of the geist mercenary team in OATH Company, supervisor of Carlson and Becas. She has a fiery personality and will not hesitate to wipe out anyone getting in her way regardless whether they are friends or enemies.",Dual-gun rapid fire,The first two weapons rapidly fires for 2.1s,Critical Spray,14% chance for shotgun weapons to fire triply. Bonus attacks won't consume ammo.,Shotgun User,Shotgun's Attack +0% and shotgun shrapnel +1.,Zeal,Final damage increases with lower HP. Maximum:25%. Cannot be stacked with other identical effects.,https://i.imgur.com/G1W3Ns6.png
Fujiwara Renai,"A rare half-blood knight from the Empire and a member of the Phantom Cross. As an aggressive person, she would rather solve the problem with fists than words.",Martial Art,Immediately uses the strongest mecha action and other mecha actions CD-20%.,Ultra,Mech’s ability cooldown -12%.,Spurred,Activates when took damages. ATK and DEF+30%. Minimum interval: 6s,Mental tolerance,Becomes immune to paralysis and interference. The duration of stun-50%,https://i.imgur.com/wUYnt7l.png
Gathena,"A member of special force Azure Girls and also a part-time idol with endless vitality. Her taste in song names is a disaster but she would always spare no effort to accomplish the missions and concerts, but would behaves strangely after drinking.",Disassembling work,Dashes and disassembles the target. Damage increases with skill level. The target can not move and be attacked in 5s,Maintenance,Heals 5% HP and removes debuffs when takes damage. Interval: 5s,Giant swing,Melee attacks apply knock up and deal bonus damage. Minimum interval: 3s,Portable wrench,Removes allies debuffs. Heals 5% HP for them and increases speed every 4s when meets them,
Glumi,A prince of a country who left his home country for an unknown reason and became the second officer for Desert Pirate Catalina after their first encounter. He appears cold and mean but actually has a soft and warm heart.,Miracle,Deals damage and knocks up nearby enemies. Becomes invulnerable for 2.5s. ATK doubles,Unlimited Awakening,The reader.pilot's active skills can be used indefinitely. Gains SP after 3s,Moody,"Gains SP, increases ATK and DEF randomly when battle begins. The limit increases with skill level.",Machinist,Heals 0.75% HP per second. Cannot be stacked with other recover per second type effects.,https://i.imgur.com/FJGYWlv.png
Gritta,"A member of the ""Azure Girls"". She holds the nature of a thug girl at who's good at picking fights and making troubles, and is always bothered by the fact that the other two members are more popular than she is. A member of the ""Azure Girls"". She holds the nature of a thug girl who's good at picking fights and making troubles, and is always bothered by the fact that the other two members are more popular than she is.",Siege,All allies charge to siege 1 enemy. Damage increases as level ups,Teammates Go First,Other units assult the enemies first. ATK+15% for 5s. The effect doubles for male pilots,Need Protection,A Random male ally's HP+14% but becomes easier to be enemies' target Increases a random male ally's HP +14% and his chance to become the enemies' target,Coverage Tactics,Final damage+7% when fire to one target. Final damage +7% when shooting one target. Can be stacked.,
Guinevere,The exclusive medic for Team Fritz in OATH Company. She is a tender girl who has a crush on Becas but is too shy to confess her feelings to him.,Emergency Treatment,Heals 18% HP(For all allies). Increases DEF for a brief time,Focus,9% chance to block all attacks. Can be stacked.,Guardian Heart,"When destroyed, generates a large shield to protect allies. Heals 5% HP.",Incentive,Gains 10% SP for the whole team when in a battle. The effect can be stacked and set off by immunity effects.,https://i.imgur.com/FMhEyPq.png
Gwen Pullan,"A roboticist framed for a crime he did not commit, Gwen Pullan is currently on the run, and is known as ""the Traitor"". He pilots the Armored Gull, but isn't quite accustomed to it due to his own level of physical fitness. He is a righteous, passionate and extremely clever young man, but when it comes to interpersonal relationships...... let's just say he's a professional singleton.",Assault reaction device,Short CD armor and defensive action's CD drastically reduces for 12s.,Attachment modification,Parts level ups 3. Ignores the level cap,See through,I can see through your attack! DEF increases every1s. Max damage reduction: 33%,Engineer,Duplicates a piece of parts which level will be 6 times of this skill. Same parts' attributes can be stacked while effects can not.,
Haruka,"Code named Doll-05, a electronic humanoid that landed together with ""Infinity"" at the same time. After her birth, she was adopted by the Tiancheng Family. She is naughty and lovely, free from vulgarity, and cannot resist to cute things. A cat enthusiast.",Wingman Matrix,"Fires a group of drones to protect yourself for 2.4s. If there is no attack drone, drone shield can be used.",Missile Mastery,Missile and drone's ATK +21%.,Escape,Increases evasion possibility when moves. Mecha gains an extra escape command. CD decreases with skill level. Min: 10s,Drone Mastery,Drone's attack interval-15%.,https://i.imgur.com/QYgjNQT.png
Haya,"This sexy Rhein girl is introverted and shy, especially when she is in front of men, sometimes she can't even speak fluently. In order to fix that, she found herself a part-time job as a waitress in the Babylon Cafe.",Tipsy,Heals 30% for 10s and inflicts slow effect (only for your allies). Only one recovery effect can be activated,Pink Seduction,Activates when debut. ATK-50% for 3s for enemies. Attack effects can be stacked,Rejection,Knocks back and applys paralysis to the enemy. Minimum interval: 2s,Reversed Celebration,Launches 3 Revenge shells when being destroyed. Damage increases when skill level ups,https://i.imgur.com/lDTf84Q.png
Heidi,"Gathena's younger sister and the ""Azure Girl"" of the Rhein Federation's special forces, she also simultaneously performs as an idol. A staunch optimist, she accepts her fate as a warrior without complaint, but still harbors a deep appreciation for music and her comrades.",Drill cannon,Launches a super drill to deal huge fire damage and apply armor penetration (if there is a successful hit),Physical penetration,Bassic attacks ignore target's 33% DEF attribute,Spiral shell,24% chance for linear shells from main armament to deal 5 stages damage,弹药师,每2s为随机武器填充一发弹药单发武器装填速度加快14%,
Heinrich,"Her negotiating skills are as remarkable as her appearance and her nickname, Blood Thirsty Lady. Heinrich likes to stay behind the curtain, so people only know that she is the president of OATH and some of her legends .",Saturation Attack,"Launches 4x rockets, 3x missiles or 2x drones for 9 times",Missile Mastery,Missile and drone's ATK +21%.,Air Command,Increase chassis evasive abilities by +60% when moving; Team Aura: 40% chance to ignore aircraft's unique ability. Does not effect grenades and grenades cannot hit aircrafts. This effect can stack.,Remote Guidance,Turns a maximum of up to 5 rounds of missiles simultaneously into homing missiles. Increases an additional round every 2 levels. This also affects ally missiles.,https://i.imgur.com/pJLtq08.png
Hilda,"As the First Sergeant of the U.S.F and a descendant of Valhalla, this resolute and sharp sergeant has won herself the honorable title of White Hunter from the force. But in an operation, she was betrayed by colleagues and then got demoted. As s a fan of blues music and black-and-white movies, she is a nostalgic person at heart.",Justice Execution,All allies launch energy waves together. Damage increases with skill level and number of allies,Cross Counterattack,Activates when receiving melee attack. Blocks and knocks target back. Minimum interval: 4s,Mental tolerance,Becomes immune to paralysis and interference. The duration of stun-50%,EM Handcuffs,Adds EM handcuffs that can track enemies to melee attacks. Minimum activation interval: 1s,https://i.imgur.com/bA8FOJV.png
Hitomi,"A electronic humanoid who always looks cold only because she does not know other ways of expression. Being separated from the institute due to an accident, she only carried the combat module with her, which makes her quite confused about human emotions.",Telekinesis Swords,Conjures mutilple flying swords that surround Hitomi for 2s. Sword is based on the mecha she is piloting. Conjures normal type telekinesis swords if the mecha isn't equiped with a sword weapon.,Reorganization,Reforms mecha up to a total of 3 times when taking fatal damage. Heals 4.5% of max HP each time.,Telekinesis Blade,8% chance for melee attacks to conjure 3 blades surrounding Hitomi. Cooldown:1.5s.,Ultra,Mech’s ability cooldown -12%.,https://i.imgur.com/XU1J0tK.png
Hong Wu,"Director of the Kunlun Institution, known as the supreme warrior titled ""Warlord of the Far East"". He is also a member of the Phantom Cross. During the Purification War, he broke into the Vatican's army alone and managed to survive.",Cutting Air Field,Creates a sharp airstream to cut enemies. DEF+40%. Damage increases with skill level,Warrior,"When there are enemies around, the final damage taken-15%. Cannot be stacked.",Play It By Ear,40% chance to counter with a Throw. Can be stacked. 40% to get up immediately when being knocked down.,Warlord,40% chance to speed up the melee attacks. Melee damage dealt+0%.,https://i.imgur.com/mJDqfJM.png
Hong Xiaoyu,Daughter of Kunlun Institution's director who left home to become a member of the Phantom Cross. She is optimistic and loves all kinds of delicious foods.,Zhu Que's Dance,"Ultimate Zhu Que's Dance, becomes invincible. Damage increases with skill level",Warrior,"When there are enemies around, the final damage taken-15%. Cannot be stacked.",Increasing Power,Final damage+12% to enemies who have more than 50% HP,Flame Dance,"Gains an extra flame dance command to the mecha. CD shortens with skill level. When the level reaches the limit, CD is reduced to 5 seconds.",https://i.imgur.com/8ZapixR.png
Icey,Protagonist of the action game <ICEY>. She is temporarily transferred to this battlefield when the game author works overtime to repair it because she fails to guide the action according to the plot and causes the game to crash down.,Crystal Overload,Launches a huge wave to damage enemies. Damage increases with skill level,Coupling,Heals 2.5% HP only when Icey casts skills . recovers 500 points shield when you had a shield,Cleanse,6% chance for melee attacks to destroy shields and force fields and apply knockdown effect.,Tracing,Evades melee and fights back. CD: 6.3s. Cannot be stacked by other evasion skills.,https://i.imgur.com/5E778Ox.png
Igarashi Meimi,"Daughter of Prof. Igarashi, the designer of Kamui Series. Since childhood, she has shown her top-notch talent and neurotic character. She kept a ferret and is obsessed with anything related to mecha.",Triangle Attack,Releases triangle attacks. Damage increases with skill level,Mini Bombard,"When a drone returns or gets destroyed, fires missiles to attack. Damage increases with skill level.",Drone Recycle,Recycles drones will double its amount. Heals 1% HP. Cannot be stacked.,Elemental Affinity,Non-normal attacks damage+10%. Non normal attacks taken-10%,https://i.imgur.com/WmRnJEp.png
Issac,永远带着笑容，为人随和的家庭餐厅老板。但黑白两道通吃的本领怎么看也不像是普通人。自家的家庭餐厅是边境约定俗成的“安全屋”……果然有隐瞒着什么吧。,绝地求生,耐久最低的友军和自己Heals 40% for 4s，机师防御参数永久增加100,Fire Suppression,射击命中时，10%概率使目标动作指令冷却时间增加1秒，最多触发28次,视觉共享系统,全体光环：我方全体受伤时，短冷却格挡/防御/回避指令冷却加速28%，含战车冲刺，此效果有1s秒触发间隔,老兵,每有一个种类的武器（主炮，副炮，飞弹，超级武器，格斗 ），造成最终伤害提升6%,
Judith,"High priestess of the Vatican. She is cold, picky and obsessively tidy. The Scripture Pavilion is always the cleanest place under her supervision. Cleaning garbage is probably her only hobby.",Hurricane Eye,"A storm that sweeps everything, lasts for 3s, affected by tenacity and weight. Becomes invulnerable for 3s",Assimilation Scripture,Mechanical Vatican's pilots only. Gains 10.5% of all kinds of HP absorption. Can be stacked.,Neat freak,Bounces off both sides. Own: ATK & DEF +21% and becomes immune to debuffs for 2s . Interval: 3.5s,Perfectionism,"When 4 or more allies are alive, final damage+ 16%.",
Kamishiro Michiru,"A wandering musician whose travels have passed through many countries. A soft-spoken, cold beauty of few words... or at least on the surface. She wishes to live alone, but deep down she longs for companionship. Her feelings become quite intense when provoked, and her anger is truly terrifying to behold. She possesses outstanding fighting skills, seemingly from past military experience.",Magnetization,Grants a aura that can drive the fire to a target. Lasts 5s,Convergence tip,The interval for our side's consecutively used active skills-20%. Only for living units,Punch shell,Normal explosive attacks apply shocking waves. The effect improves with skill level,Resonance Barrier,Activates when the enemy casts an active skill. Whole team DEF+20% for 3s.,
Kaoru,"A famous idol of Hinomaru who goes by the stage name of the ""Electric Fairy"". She has a warm and sunny personality, and takes her work as an idol seriously, and is quite strict both with herself and others. Although adored by millions, she has a number of secrets to hide.",安可,吸引附近敌人注意力并制造音浪，持续5s,应援团,随机友方成为应援团，与薰一起制造音浪，升级提升强度,握手会,碰撞时弹开目标，目标攻击大幅降低，自己恢复耐久8%，触发间隔3s,谢幕,耐久低于40%和受致命伤时进入隐身状态，持续3s,https://i.imgur.com/7gJmRX0.png
Karas,A terrifying woman from the Northern Land. Her brilliant strategy can easily make her preys fall into the trap and they will only realize that the reaper's scythe is upon them until the very last moment.,Attraction·Repulsion,Releases powerful repulsion to kncok enemies back for 4.2s.,Time-Frozen Barrier,Gains a barrier that can pause the shell. Radius increases with skill level,Death Struggle,"Removes debuffs and reverts back to the position and HP 2s ago, when take fatal damage",Void Walk,Teleports a short-distance and temporarily improves defense. Minimum interval:3,https://i.imgur.com/tNOItvs.png
Kashina Souji,"Sworn to serve the Divine Empress as the sacred and impassable gatekeeper. His swordsmanship represents the absolute pinnacle of skill, and any who wish to steal the secrets of the Divine Empress and the palace soon meet their doom on the end of his blade. He is earnest and magnanimous in his dealings with others, although his long isolation from the outside world has made him a bit out of touch.",秘剑·水面雷光,全方位斩击！持续3s秒,Advanced Sword Arts,Permanently increases 1% melee damage when there is a successful melee hit. At most 50 times,Tranquility,Damage taken-10%. Becomes immune to burning. The duration of stun and interference-50%,Bang,Melee attack hit causes huge damage and ignores immunized Stuns for 1s. Triggers on each unit for only once.,
Kelly,"A Superintendent 1st Class from U.S.F and a supervisor of Hilda after her demotion. She is a lazy and careless officer who loves video games and anime. However, sometimes you can see a hint of sharpness from her eyes.",Disarm,All enemies cannot attack within 2.1s.,Secondary Armament Scatter,12% chance for the secondary armament to shoot in a 5-directional scattershot without consuming ammo.,First Aid,Heals 5% HP to an ally with the lowest HP every 6s.,Epidemic Laziness,ATK-21% briefly when enemies are nearby. Reduces SP slightly,https://i.imgur.com/0ZEIuoy.png
Kemuri,"Although she is quite familiar with the cruel rules of living in the Northern Land, she has not lost her humanity in killing. However, if anyone gets fooled by her looks and approaches her without permission, she will not give them an easy way out.",Attraction·Magnet,Releases strong magnets to keep enemies from escaping for 4.2s,Time-Lag Barrier,Gains a barrier that can reduce the shell speed and range throughout the battle. Radius increases with skill level,Death Struggle,"Removes debuffs and reverts back to the position and HP 2s ago, when take fatal damage",Void Walk,Teleports a short-distance and temporarily improves defense. Minimum interval:3,
Khaz,"The tactician for Rattlesnake Sandsea Thieves. He is a hot-blooded dummy who values friendship and loyalty a lot. Although he could only find a decent job with his strength, he still decided to earn his living by intelligence. He is clueless when it comes to girls and has been dumped over 100 times, and he is still a virgin.",Collision,All allies dash forward. Damage increases with skill level.,Fearless Assault,All allies launch themselves forward and become invulnerable for 2s.,Approach,DEF+20% briefly for a nearby ally,Formidable,"Activates when an enemy is killed. Group ATK+20% for 4s, the effect halves if the enemy is killed by a teammate.",https://i.imgur.com/oZ8YVkN.png
